{"baseline": "ja_benchmark_v0.12.1-leak-fixed", "data_hash": "unknown", "duration_minutes": 0.5, "hypothesis": "OSS NER (ja_core_news_trf / ja_ginza / ja_core_news_md + Presidio) outperforms custom CNN by >=3pt matched-precision recall on ORG/DOB at p>=0.7 budget; v0.12.1-leak-fixed corpus, Bonferroni alpha/28", "id": "baseline_comparison_2026_05_02_v0_12_1", "intervention_type": "baseline_comparison", "language": "ja", "legacy": {"artifact_path": "packages/training/experiments/artifacts/measure-2026-05-02/comparison.json", "duration_minutes": 0.5, "honesty_caveats": ["5 docs leaked (negative_operational_a, no entities) detected by F0a; corpus repaired to v0.12.1-leak-fixed before measurement", "Deeper leakage from training-template overlap (custom NER trained on data from same template engine producing benchmark) is unmeasured; results favor custom on this in-domain corpus", "custom_bert variant deferred — output/ja-v02-trf/model-best artifact absent locally; full 5-variant comparison requires RunPod training", "Score-bearing tie-break collapses to doc-order for Presidio variants (uniform 0.85 score) — P0-5 caveat realized empirically"], "hypothesis": "OSS NER (ja_core_news_trf / ja_ginza / ja_core_news_md + Presidio) outperforms custom CNN by >=3pt matched-precision recall on ORG/DOB at p>=0.7 budget; v0.12.1-leak-fixed corpus, Bonferroni alpha/28", "id": "baseline_comparison_2026_05_02_v0_12_1", "intervention_type": "baseline_comparison", "language": "ja", "metrics_after": {"DATE_OF_BIRTH": {"ci_hi_bonferroni": 0.0, "ci_lo_bonferroni": 0.0, "custom_best_p_overlap": 0.958, "custom_best_r_overlap": 1.0, "mean_diff": 0.0, "n_eligible_templates": 3, "operational_signal": "tied (custom matches OSS at perfect recall)", "oss_best_p_overlap": 0.958, "oss_best_r_overlap": 1.0, "oss_best_variant": "ja_ginza", "verdict": "NO_DECISION"}, "ORGANIZATION": {"custom_best_p_overlap": 0.919, "custom_best_r_overlap": 0.919, "n_eligible_templates": 0, "operational_signal": "custom_better (OSS cannot meet p_budget)", "oss_best_p_overlap": null, "verdict": "NO_DECISION"}}, "reason": "ORG: all OSS variants below p>=0.7 budget at every percentile (Presidio uniform score 0.85 collapses sweep to doc-order); custom_cnn p=0.919 r=0.919. DOB: tied at recall=1.0 between ja_ginza and custom_cnn on 3 eligible templates; r7 fails because mean_diff=0. Rule-strict NO_DECISION x2; operational signal favors custom (OSS cannot reach precision budget on ORG, custom matches on DOB).", "timestamp": "2026-05-02T09:42:31.858904+00:00", "verdict": "NO_DECISION"}, "metrics_after": {"DATE_OF_BIRTH": {"ci_hi_bonferroni": 0.0, "ci_lo_bonferroni": 0.0, "custom_best_p_overlap": 0.958, "custom_best_r_overlap": 1.0, "mean_diff": 0.0, "n_eligible_templates": 3, "operational_signal": "tied (custom matches OSS at perfect recall)", "oss_best_p_overlap": 0.958, "oss_best_r_overlap": 1.0, "oss_best_variant": "ja_ginza", "verdict": "NO_DECISION"}, "ORGANIZATION": {"custom_best_p_overlap": 0.919, "custom_best_r_overlap": 0.919, "n_eligible_templates": 0, "operational_signal": "custom_better (OSS cannot meet p_budget)", "oss_best_p_overlap": null, "verdict": "NO_DECISION"}}, "metrics_before": {}, "reason": "ORG: all OSS variants below p>=0.7 budget at every percentile (Presidio uniform score 0.85 collapses sweep to doc-order); custom_cnn p=0.919 r=0.919. DOB: tied at recall=1.0 between ja_ginza and custom_cnn on 3 eligible templates; r7 fails because mean_diff=0. Rule-strict NO_DECISION x2; operational signal favors custom (OSS cannot reach precision budget on ORG, custom matches on DOB).", "timestamp": "2026-05-02T09:42:31.858904+00:00", "verdict": "NO_DECISION"}
{"baseline": "ja_benchmark_v0.13.0_heldout", "data_hash": "unknown", "duration_minutes": 0.14, "hypothesis": "Custom CNN performance on held-out template benchmark v0.13.0 confirms or invalidates iteration-2 in-domain validation by removing training-template overlap concern. Train-templates: payment_exports_a, leaked_attachments_a, mixed_dummy_real_a. Test-templates (held-out): ocr_forms_a, logistics_labels_b, partially_redacted_public_a.", "id": "baseline_comparison_2026_05_02_v0_13_0_heldout", "intervention_type": "baseline_comparison", "language": "ja", "legacy": {"artifact_path": "packages/training/experiments/artifacts/measure-heldout-2026-05-02/comparison.json", "compared_to_iteration_2": "ORG: in-domain p=0.919 r=0.919 → held-out p=1.0 r=0.875 (similar performance); DOB: same perfect recall pattern. Conclusion: custom NER generalizes; iteration-2 result was honest, not in-domain biased.", "duration_minutes": 0.14, "honesty_caveats": ["Test-template subset is small (3 templates, 16 ORG / 10 DOB spans); only ocr_forms_a is min_spans-eligible for DOB", "Iteration-2 in-domain training-template overlap concern is empirically rejected: custom_cnn maintains p>=0.919 on both partitions", "custom_bert still deferred (RunPod training pending)"], "hypothesis": "Custom CNN performance on held-out template benchmark v0.13.0 confirms or invalidates iteration-2 in-domain validation by removing training-template overlap concern. Train-templates: payment_exports_a, leaked_attachments_a, mixed_dummy_real_a. Test-templates (held-out): ocr_forms_a, logistics_labels_b, partially_redacted_public_a.", "id": "baseline_comparison_2026_05_02_v0_13_0_heldout", "intervention_type": "baseline_comparison", "language": "ja", "metrics_after": {"DATE_OF_BIRTH": {"custom_best_p_overlap": 1.0, "custom_best_r_overlap": 1.0, "n_eligible_templates": 1, "operational_signal": "custom_better (slightly higher precision; tied recall)", "oss_best_p_overlap": 0.909, "oss_best_r_overlap": 1.0, "oss_best_variant": "ja_ginza", "verdict": "NO_DECISION"}, "ORGANIZATION": {"custom_best_p_overlap": 1.0, "custom_best_r_overlap": 0.875, "operational_signal": "custom_better (OSS unfit at p_budget on held-out)", "oss_best_p_overlap": null, "verdict": "NO_DECISION"}}, "reason": "Rule-strict NO_DECISION x 2: ORG (OSS unfit at p_budget), DOB (tied at perfect recall on 1 eligible template, n_eligible<4 eligibility guard fires). Operational signal STRONGER than iteration-2: custom_cnn p=1.0 r=0.875 on ORG (zero FPs on held-out), p=1.0 r=1.0 on DOB; OSS still cannot reach p_budget. Custom NER generalizes to held-out templates.", "timestamp": "2026-05-02T09:52:20.417871+00:00", "verdict": "NO_DECISION"}, "metrics_after": {"DATE_OF_BIRTH": {"custom_best_p_overlap": 1.0, "custom_best_r_overlap": 1.0, "n_eligible_templates": 1, "operational_signal": "custom_better (slightly higher precision; tied recall)", "oss_best_p_overlap": 0.909, "oss_best_r_overlap": 1.0, "oss_best_variant": "ja_ginza", "verdict": "NO_DECISION"}, "ORGANIZATION": {"custom_best_p_overlap": 1.0, "custom_best_r_overlap": 0.875, "operational_signal": "custom_better (OSS unfit at p_budget on held-out)", "oss_best_p_overlap": null, "verdict": "NO_DECISION"}}, "metrics_before": {}, "reason": "Rule-strict NO_DECISION x 2: ORG (OSS unfit at p_budget), DOB (tied at perfect recall on 1 eligible template, n_eligible<4 eligibility guard fires). Operational signal STRONGER than iteration-2: custom_cnn p=1.0 r=0.875 on ORG (zero FPs on held-out), p=1.0 r=1.0 on DOB; OSS still cannot reach p_budget. Custom NER generalizes to held-out templates.", "timestamp": "2026-05-02T09:52:20.417871+00:00", "verdict": "NO_DECISION"}
{"baseline": "v0.12.0/ja", "data_hash": "unknown", "duration_minutes": 11, "hypothesis": "GPU 訓練 + Wikipedia external hardneg (#64) + ORG diverse positives (#80) で adversarial precision 33% → 70%+", "id": "20260503_iter12_aug_ext_runpod_gpu", "intervention_type": "data_augmentation+training_hardware", "language": "ja", "legacy": {"aggregation": "micro", "artifact_eval_doc": "packages/training/models/hf-ja-v02-tiny-aug-ext-eval-v012.md", "changes": ["packages/training/Makefile (convert/train-hf-v02-tiny-aug-ext targets)", "packages/training/data/raw/ja-v02/augmented_with_external.json", "RunPod RTX A5000 community pod"], "corpus": "v0.12.0/ja", "cost_usd": 0.05, "delta": {"ADDRESS_f1": "+0.055", "BANK_ACCOUNT_f1": "+0.159", "DATE_OF_BIRTH_f1": "+0.023", "ORGANIZATION_f1": "+0.004", "PERSON_f1": "+0.072", "overall_f1": "+0.036", "overall_p": "+0.040", "overall_r": "-0.106"}, "duration_minutes": 11, "final_loss": 0.143, "hypothesis": "GPU 訓練 + Wikipedia external hardneg (#64) + ORG diverse positives (#80) で adversarial precision 33% → 70%+", "id": "20260503_iter12_aug_ext_runpod_gpu", "intervention_type": "data_augmentation+training_hardware", "language": "ja", "metric": "strict_span_f1", "metrics_after": {"ADDRESS_f1": 0.722, "BANK_ACCOUNT_f1": 0.717, "DATE_OF_BIRTH_f1": 0.613, "ORGANIZATION_f1": 0.16, "PERSON_f1": 0.951, "model": "hf_v02_tiny_aug_ext", "overall_f1": 0.452, "overall_p": 0.303, "overall_r": 0.883}, "metrics_before": {"ADDRESS_f1": 0.667, "BANK_ACCOUNT_f1": 0.558, "DATE_OF_BIRTH_f1": 0.59, "ORGANIZATION_f1": 0.156, "PERSON_f1": 0.879, "model": "hf_v02_tiny_hardneg", "overall_f1": 0.416, "overall_p": 0.263, "overall_r": 0.989}, "pod": "RunPod RTX A5000 community", "reason": "AC (precision >=70%) NOT MET (achieved 30.3%). ORG precision (8.8%) remains dominant FP source. 4/5 entities improved; BANK +15.9pt F1 best gain. Tag model/v0.13.0 deferred. Follow-up issue for ORG-FP needed.", "timestamp": "2026-05-03T00:00:00+09:00", "training_steps": 20700, "verdict": "KEEP_PARTIAL"}, "metrics_after": {"ADDRESS_f1": 0.722, "BANK_ACCOUNT_f1": 0.717, "DATE_OF_BIRTH_f1": 0.613, "ORGANIZATION_f1": 0.16, "PERSON_f1": 0.951, "model": "hf_v02_tiny_aug_ext", "overall_f1": 0.452, "overall_p": 0.303, "overall_r": 0.883}, "metrics_before": {"ADDRESS_f1": 0.667, "BANK_ACCOUNT_f1": 0.558, "DATE_OF_BIRTH_f1": 0.59, "ORGANIZATION_f1": 0.156, "PERSON_f1": 0.879, "model": "hf_v02_tiny_hardneg", "overall_f1": 0.416, "overall_p": 0.263, "overall_r": 0.989}, "reason": "AC (precision >=70%) NOT MET (achieved 30.3%). ORG precision (8.8%) remains dominant FP source. 4/5 entities improved; BANK +15.9pt F1 best gain. Tag model/v0.13.0 deferred. Follow-up issue for ORG-FP needed.", "timestamp": "2026-05-03T00:00:00+09:00", "verdict": "KEEP"}
{"baseline": "ai4privacy/pii-masking-300k @ validation, n=300, IoU=0.5", "data_hash": "unknown", "hypothesis": "builtin EN の NER 出力が Presidio 層で破棄されている: pleno taxonomy (ADDRESS/BANK_ACCOUNT/DATE_OF_BIRTH/ORGANIZATION) が NerModelConfiguration のデフォルトマッピングに無く、SpacyRecognizer の supported_entities にも無い。identity mapping + PlenoNerRecognizer 登録で NER 寄与を復元すれば overall F1 +20% 以上 (0.315 → 0.38+, 期待値 0.45-0.55)", "id": "20260705_iter13_presidio_label_mapping", "intervention_type": "label_mapping", "language": "en", "legacy": {"baseline": "ai4privacy/pii-masking-300k @ validation, n=300, IoU=0.5", "changes": ["packages/sdk/src/pleno_anonymize/_local.py"], "delta": {"BOD_recall": "+0.19", "DATE_recall": "+0.058", "overall_f1": "+0.0096 (+3.0%)"}, "hypothesis": "builtin EN の NER 出力が Presidio 層で破棄されている: pleno taxonomy (ADDRESS/BANK_ACCOUNT/DATE_OF_BIRTH/ORGANIZATION) が NerModelConfiguration のデフォルトマッピングに無く、SpacyRecognizer の supported_entities にも無い。identity mapping + PlenoNerRecognizer 登録で NER 寄与を復元すれば overall F1 +20% 以上 (0.315 → 0.38+, 期待値 0.45-0.55)", "id": "20260705_iter13_presidio_label_mapping", "intervention_type": "label_mapping", "language": "en", "metrics_after": {"BOD_recall": 0.6, "DATE_recall": 0.377, "GIVENNAME1_recall": 0.0, "avg_latency_ms": 66.85, "overall_f1": 0.3343, "precision": 0.3957, "recall": 0.2894}, "metrics_before": {"BOD_recall": 0.41, "GIVENNAME1_recall": 0.0, "avg_latency_ms": 111.65, "overall_f1": 0.3247, "precision": 0.3979, "recall": 0.2742}, "note": "RunPod CPU pod (cpu3g, US-CA-2) で同一環境 before/after 測定。baseline latency はwheel DL込みのアーティファクト", "reason": "DATE_OF_BIRTH/ADDRESS が surfacing 開始 (BOD +19pt)。ただし EN モデル自体が pii-300k で PERSON をほぼ検出できず names recall 0 のまま。次: train split での再訓練", "timestamp": "2026-07-05T16:45:00+09:00", "verdict": "KEEP"}, "metrics_after": {"BOD_recall": 0.6, "DATE_recall": 0.377, "GIVENNAME1_recall": 0.0, "avg_latency_ms": 66.85, "overall_f1": 0.3343, "precision": 0.3957, "recall": 0.2894}, "metrics_before": {"BOD_recall": 0.41, "GIVENNAME1_recall": 0.0, "avg_latency_ms": 111.65, "overall_f1": 0.3247, "precision": 0.3979, "recall": 0.2742}, "reason": "DATE_OF_BIRTH/ADDRESS が surfacing 開始 (BOD +19pt)。ただし EN モデル自体が pii-300k で PERSON をほぼ検出できず names recall 0 のまま。次: train split での再訓練", "timestamp": "2026-07-05T16:45:00+09:00", "verdict": "KEEP"}
{"baseline": "ai4privacy/pii-masking-300k @ validation, n=300, IoU=0.5", "data_hash": "unknown", "duration_minutes": 35, "hypothesis": "pii-300k train split (EN 25k docs) + 既存合成9.8k で in-domain 訓練すれば公開ベンチ F1 の上限 (ceiling) を測定できる", "id": "20260705_iter14_pii300k_ceiling_internal", "intervention_type": "training_data (ceiling experiment, NOT shippable)", "language": "en", "legacy": {"baseline": "ai4privacy/pii-masking-300k @ validation, n=300, IoU=0.5", "changes": ["RunPod RTX 3090 (secure) で spacy CNN 訓練, step 8800 early-stop, dev F 94.6"], "cost_usd": 0.3, "delta": {"overall_f1": "+0.343 (+102.6%)"}, "duration_minutes": 35, "hypothesis": "pii-300k train split (EN 25k docs) + 既存合成9.8k で in-domain 訓練すれば公開ベンチ F1 の上限 (ceiling) を測定できる", "id": "20260705_iter14_pii300k_ceiling_internal", "intervention_type": "training_data (ceiling experiment, NOT shippable)", "language": "en", "metrics_after": {"avg_latency_ms": 25.83, "overall_f1": 0.6773, "precision": 0.6225, "recall": 0.7427}, "metrics_before": {"overall_f1": 0.3343, "precision": 0.3957, "recall": 0.2894}, "pod": "RunPod RTX 3090 secure EU-CZ-1", "reason": "AI4Privacy license (非商用・派生物公開に書面許諾必須) のため wheel は配布不可。ceiling として記録し、出荷モデルは Faker 合成 (iter15) で追求", "timestamp": "2026-07-05T17:30:00+09:00", "verdict": "INTERNAL_ONLY"}, "metrics_after": {"avg_latency_ms": 25.83, "overall_f1": 0.6773, "precision": 0.6225, "recall": 0.7427}, "metrics_before": {"overall_f1": 0.3343, "precision": 0.3957, "recall": 0.2894}, "reason": "AI4Privacy license (非商用・派生物公開に書面許諾必須) のため wheel は配布不可。ceiling として記録し、出荷モデルは Faker 合成 (iter15) で追求", "timestamp": "2026-07-05T17:30:00+09:00", "verdict": "DISCARD"}
{"baseline": "ai4privacy/pii-masking-300k @ validation, n=300, IoU=0.5", "data_hash": "unknown", "duration_minutes": 25, "hypothesis": "ライセンスクリーンな Faker 合成 20k docs (コンポーネント粒度スパン: given/last name 個別・住所を street/city/postcode 個別) + 既存 LLM 合成 9.8k (粒度分割変換) で EN モデルを再訓練し、さらに analyze() の重複 finding 排除 (同一数字列への US_DRIVER_LICENSE/US_BANK_NUMBER/US_SSN 多重発火を除去) で F1 +20% 以上", "id": "20260705_iter15_faker_component_spans_plus_dedup", "intervention_type": "training_data + sdk_postprocess", "language": "en", "legacy": {"baseline": "ai4privacy/pii-masking-300k @ validation, n=300, IoU=0.5", "changes": ["generate_faker_en.py (新規, scratchpad→PR に同梱予定)", "packages/sdk/src/pleno_anonymize/_local.py (_dedupe_overlaps)", "packages/sdk/src/pleno_anonymize/_models.py (0.3.0 URL bump)"], "cost_usd": 0.25, "delta": {"avg_latency_ms": "-65%", "overall_f1": "+0.2469 (+73.9% vs mapping-fix, +79.0% vs 0.2.1 baseline)", "precision": "+0.357", "wheel_size": "-28%"}, "duration_minutes": 25, "hypothesis": "ライセンスクリーンな Faker 合成 20k docs (コンポーネント粒度スパン: given/last name 個別・住所を street/city/postcode 個別) + 既存 LLM 合成 9.8k (粒度分割変換) で EN モデルを再訓練し、さらに analyze() の重複 finding 排除 (同一数字列への US_DRIVER_LICENSE/US_BANK_NUMBER/US_SSN 多重発火を除去) で F1 +20% 以上", "id": "20260705_iter15_faker_component_spans_plus_dedup", "intervention_type": "training_data + sdk_postprocess", "language": "en", "metrics_after": {"avg_latency_ms": 23.31, "model_only_f1": 0.4667, "overall_f1": 0.5812, "precision": 0.7522, "recall": 0.4735, "wheel_mb": 25}, "metrics_before": {"avg_latency_ms": 66.85, "overall_f1": 0.3343, "precision": 0.3957, "recall": 0.2894, "wheel_mb": 35}, "per_label_no_regressions": true, "pod": "train: RunPod RTX3090 secure / eval: RunPod cpu3g secure (同一環境 ladder 測定)", "reason": "Smoke tier (0.50) 突破。EMAIL/IP recall 1.0 維持、全27ラベルでリグレッションなし。names recall はまだ 0.19-0.21 (ceiling 0.74) — Faker名前プールの多様性が次の課題", "timestamp": "2026-07-05T17:50:00+09:00", "verdict": "KEEP"}, "metrics_after": {"avg_latency_ms": 23.31, "model_only_f1": 0.4667, "overall_f1": 0.5812, "precision": 0.7522, "recall": 0.4735, "wheel_mb": 25}, "metrics_before": {"avg_latency_ms": 66.85, "overall_f1": 0.3343, "precision": 0.3957, "recall": 0.2894, "wheel_mb": 35}, "reason": "Smoke tier (0.50) 突破。EMAIL/IP recall 1.0 維持、全27ラベルでリグレッションなし。names recall はまだ 0.19-0.21 (ceiling 0.74) — Faker名前プールの多様性が次の課題", "timestamp": "2026-07-05T17:50:00+09:00", "verdict": "KEEP"}
{"baseline": "frozen internal benchmarks v0.4.0 (2976 docs) + v0.13.0-held-out, strict-span F1, 同一 RunPod 環境 ladder", "data_hash": "unknown", "duration_minutes": 30, "hypothesis": "出荷 JA wheel 0.2.0 (凍結ベンチ v0.4.0 F=0.6005) はリポ内最良モデル (0.8692) と大幅乖離。iter10 訓練データ 28k + Faker ja_JP 合成 25k (JA 慣習の全体スパン粒度) の統合 53k docs 再訓練で in-domain と held-out 汎化を両立できる", "id": "20260705_iter16_ja_combined_faker_retrain", "intervention_type": "training_data + release_gap_fix", "language": "ja", "legacy": {"baseline": "frozen internal benchmarks v0.4.0 (2976 docs) + v0.13.0-held-out, strict-span F1, 同一 RunPod 環境 ladder", "changes": ["packages/training/src/pleno_ner_training/generate_faker_ja.py (新規)", "packages/sdk/src/pleno_anonymize/_models.py (ja 0.3.0 URL)", "Dockerfile (ja pin 0.3.0)"], "cost_usd": 0.35, "delta": {"heldout_f": "+0.1083 (+15.5% vs shipped)", "v04_f": "+0.2538 (+42.3% vs shipped)"}, "duration_minutes": 30, "hypothesis": "出荷 JA wheel 0.2.0 (凍結ベンチ v0.4.0 F=0.6005) はリポ内最良モデル (0.8692) と大幅乖離。iter10 訓練データ 28k + Faker ja_JP 合成 25k (JA 慣習の全体スパン粒度) の統合 53k docs 再訓練で in-domain と held-out 汎化を両立できる", "id": "20260705_iter16_ja_combined_faker_retrain", "intervention_type": "training_data + release_gap_fix", "language": "ja", "metrics_after": {"heldout_f": 0.8077, "heldout_p": 0.7059, "heldout_r": 0.9438, "model": "combined (iter10 data + faker_ja)", "ms_per_doc": 6.02, "v04_f": 0.8543, "v04_p": 0.8563, "v04_r": 0.8523}, "metrics_before": {"heldout_f": 0.6994, "model": "shipped wheel 0.2.0", "ms_per_doc": 5.77, "v04_f": 0.6005, "v04_p": 0.7508, "v04_r": 0.5003}, "pod": "RunPod RTX 3090 secure EU-CZ-1", "reason": "出荷 wheel を両凍結ベンチで大幅超過。held-out F は全候補中最高 (0.8077)。iter10 最良比では v0.4 -1.5pt だが held-out +6.8pt で汎化優先。wheel 0.3.0 として HF 公開", "reference_candidates": {"faker_only": {"heldout_f": 0.7701, "v04_f": 0.7004}, "iter10_local_best": {"heldout_f": 0.7397, "note": "v0.4 過適合 (held-out P 0.62)", "v04_f": 0.8692}}, "timestamp": "2026-07-05T19:40:00+09:00", "verdict": "KEEP"}, "metrics_after": {"heldout_f": 0.8077, "heldout_p": 0.7059, "heldout_r": 0.9438, "model": "combined (iter10 data + faker_ja)", "ms_per_doc": 6.02, "overall_f1": 0.8543, "v04_f": 0.8543, "v04_p": 0.8563, "v04_r": 0.8523}, "metrics_before": {"heldout_f": 0.6994, "model": "shipped wheel 0.2.0", "ms_per_doc": 5.77, "overall_f1": 0.6005, "v04_f": 0.6005, "v04_p": 0.7508, "v04_r": 0.5003}, "reason": "出荷 wheel を両凍結ベンチで大幅超過。held-out F は全候補中最高 (0.8077)。iter10 最良比では v0.4 -1.5pt だが held-out +6.8pt で汎化優先。wheel 0.3.0 として HF 公開", "timestamp": "2026-07-05T19:40:00+09:00", "verdict": "KEEP"}
