{"baseline": "ja_frozen_benchmark_v0.4.0", "data_hash": "unknown", "duration_minutes": 15, "hypothesis": "Augmentation 1000→3000, ORGANIZATION/BANK_ACCOUNT templates expanded, distribution rebalanced (ORG 15→20%, BANK 10→13%)", "id": "20260402_iter01_augment_3x_org_bank_templates", "intervention_type": "data_augmentation", "language": "ja", "legacy": {"changes": ["packages/training/src/pleno_ner_training/augment_ja_data.py", "packages/training/src/pleno_ner_training/convert_to_docbin.py"], "delta": {"ADDRESS_f1": "+0.116", "BANK_ACCOUNT_f1": "+0.090", "DATE_OF_BIRTH_f1": "-0.054", "ORGANIZATION_f1": "+0.118", "overall_f1": "+0.050"}, "duration_minutes": 15, "hypothesis": "Augmentation 1000→3000, ORGANIZATION/BANK_ACCOUNT templates expanded, distribution rebalanced (ORG 15→20%, BANK 10→13%)", "id": "20260402_iter01_augment_3x_org_bank_templates", "intervention_type": "data_augmentation", "language": "ja", "metrics_after": {"ADDRESS_f1": 0.745, "BANK_ACCOUNT_f1": 0.662, "DATE_OF_BIRTH_f1": 0.539, "ORGANIZATION_f1": 0.541, "PERSON_f1": 0.67, "overall_f1": 0.65}, "metrics_before": {"ADDRESS_f1": 0.629, "BANK_ACCOUNT_f1": 0.572, "DATE_OF_BIRTH_f1": 0.593, "ORGANIZATION_f1": 0.423, "PERSON_f1": 0.668, "overall_f1": 0.6}, "reason": "Overall F1 +5.0%, ORG/ADDRESS/BANK major improvement. DATE_OF_BIRTH regressed -5.4% but net positive.", "timestamp": "2026-04-02T10:00:00+09:00", "verdict": "KEEP"}, "metrics_after": {"ADDRESS_f1": 0.745, "BANK_ACCOUNT_f1": 0.662, "DATE_OF_BIRTH_f1": 0.539, "ORGANIZATION_f1": 0.541, "PERSON_f1": 0.67, "overall_f1": 0.65}, "metrics_before": {"ADDRESS_f1": 0.629, "BANK_ACCOUNT_f1": 0.572, "DATE_OF_BIRTH_f1": 0.593, "ORGANIZATION_f1": 0.423, "PERSON_f1": 0.668, "overall_f1": 0.6}, "reason": "Overall F1 +5.0%, ORG/ADDRESS/BANK major improvement. DATE_OF_BIRTH regressed -5.4% but net positive.", "timestamp": "2026-04-02T10:00:00+09:00", "verdict": "KEEP"}
{"baseline": "ja_frozen_benchmark_v0.4.0", "data_hash": "unknown", "duration_minutes": 25, "hypothesis": "CNN width 128→256, hidden_width 64→128, embed_size 2000→4000 + DATE_OF_BIRTH templates expanded", "id": "20260402_iter02_wider_cnn_dob_templates", "intervention_type": "training_config", "language": "ja", "legacy": {"changes": ["packages/training/configs/train_cnn.cfg", "packages/training/src/pleno_ner_training/augment_ja_data.py"], "delta": {"ADDRESS_f1": "-0.083", "overall_f1": "+0.011"}, "duration_minutes": 25, "hypothesis": "CNN width 128→256, hidden_width 64→128, embed_size 2000→4000 + DATE_OF_BIRTH templates expanded", "id": "20260402_iter02_wider_cnn_dob_templates", "intervention_type": "training_config", "language": "ja", "metrics_after": {"ADDRESS_f1": 0.662, "BANK_ACCOUNT_f1": 0.671, "DATE_OF_BIRTH_f1": 0.595, "ORGANIZATION_f1": 0.593, "PERSON_f1": 0.711, "overall_f1": 0.661}, "metrics_before": {"ADDRESS_f1": 0.745, "BANK_ACCOUNT_f1": 0.662, "DATE_OF_BIRTH_f1": 0.539, "ORGANIZATION_f1": 0.541, "PERSON_f1": 0.67, "overall_f1": 0.65}, "reason": "ADDRESS regressed -8.3%. Model size 7MB→24.7MB, latency 4ms→13.4ms. Reverted CNN config.", "timestamp": "2026-04-02T11:00:00+09:00", "verdict": "DISCARD"}, "metrics_after": {"ADDRESS_f1": 0.662, "BANK_ACCOUNT_f1": 0.671, "DATE_OF_BIRTH_f1": 0.595, "ORGANIZATION_f1": 0.593, "PERSON_f1": 0.711, "overall_f1": 0.661}, "metrics_before": {"ADDRESS_f1": 0.745, "BANK_ACCOUNT_f1": 0.662, "DATE_OF_BIRTH_f1": 0.539, "ORGANIZATION_f1": 0.541, "PERSON_f1": 0.67, "overall_f1": 0.65}, "reason": "ADDRESS regressed -8.3%. Model size 7MB→24.7MB, latency 4ms→13.4ms. Reverted CNN config.", "timestamp": "2026-04-02T11:00:00+09:00", "verdict": "DISCARD"}
{"baseline": "ja_frozen_benchmark_v0.4.0", "data_hash": "unknown", "duration_minutes": 15, "hypothesis": "score_weights ents_f=0.5 ents_r=0.5 + augmentation 5000", "id": "20260402_iter03_recall_weight_aug5000", "intervention_type": "training_config", "language": "ja", "legacy": {"changes": ["packages/training/configs/train_cnn.cfg"], "delta": {"ADDRESS_f1": "-0.064", "BANK_ACCOUNT_f1": "-0.030", "overall_f1": "+0.018"}, "duration_minutes": 15, "hypothesis": "score_weights ents_f=0.5 ents_r=0.5 + augmentation 5000", "id": "20260402_iter03_recall_weight_aug5000", "intervention_type": "training_config", "language": "ja", "metrics_after": {"ADDRESS_f1": 0.681, "BANK_ACCOUNT_f1": 0.632, "DATE_OF_BIRTH_f1": 0.608, "ORGANIZATION_f1": 0.541, "PERSON_f1": 0.746, "overall_f1": 0.668}, "metrics_before": {"ADDRESS_f1": 0.745, "BANK_ACCOUNT_f1": 0.662, "DATE_OF_BIRTH_f1": 0.539, "ORGANIZATION_f1": 0.541, "PERSON_f1": 0.67, "overall_f1": 0.65}, "reason": "ADDRESS -6.4%, BANK_ACCOUNT -3.0% regression. 2 consecutive DISCARDs, switching to data_generation category.", "timestamp": "2026-04-02T12:00:00+09:00", "verdict": "DISCARD"}, "metrics_after": {"ADDRESS_f1": 0.681, "BANK_ACCOUNT_f1": 0.632, "DATE_OF_BIRTH_f1": 0.608, "ORGANIZATION_f1": 0.541, "PERSON_f1": 0.746, "overall_f1": 0.668}, "metrics_before": {"ADDRESS_f1": 0.745, "BANK_ACCOUNT_f1": 0.662, "DATE_OF_BIRTH_f1": 0.539, "ORGANIZATION_f1": 0.541, "PERSON_f1": 0.67, "overall_f1": 0.65}, "reason": "ADDRESS -6.4%, BANK_ACCOUNT -3.0% regression. 2 consecutive DISCARDs, switching to data_generation category.", "timestamp": "2026-04-02T12:00:00+09:00", "verdict": "DISCARD"}
{"baseline": "ja_frozen_benchmark_v0.4.0", "data_hash": "unknown", "duration_minutes": 40, "hypothesis": "Add v0.4.0 weakness-targeted templates: ORG adjacent patterns (10%), DOB multi-date patterns (10%), era abbreviation DOB formats (S40.5.10, H2/3/15), minimal context (6%), structured noise (6%). Augment count 1000→5000. ORG abbreviated prefixes (（株）etc).", "id": "20260402_iter04_targeted_org_dob_patterns", "intervention_type": "data_augmentation", "language": "ja", "legacy": {"changes": ["packages/training/src/pleno_ner_training/augment_ja_data.py", "packages/training/Makefile"], "delta": {"ADDRESS_f1": "+0.102", "BANK_ACCOUNT_f1": "+0.044", "DATE_OF_BIRTH_f1": "+0.272", "ORGANIZATION_f1": "+0.054", "PERSON_f1": "+0.058", "overall_f1": "+0.095"}, "duration_minutes": 40, "hypothesis": "Add v0.4.0 weakness-targeted templates: ORG adjacent patterns (10%), DOB multi-date patterns (10%), era abbreviation DOB formats (S40.5.10, H2/3/15), minimal context (6%), structured noise (6%). Augment count 1000→5000. ORG abbreviated prefixes (（株）etc).", "id": "20260402_iter04_targeted_org_dob_patterns", "intervention_type": "data_augmentation", "language": "ja", "metrics_after": {"ADDRESS_f1": 0.748, "ADDRESS_r": 0.733, "BANK_ACCOUNT_f1": 0.745, "BANK_ACCOUNT_r": 0.699, "DATE_OF_BIRTH_f1": 0.816, "DATE_OF_BIRTH_r": 0.739, "ORGANIZATION_f1": 0.621, "ORGANIZATION_r": 0.547, "PERSON_f1": 0.794, "PERSON_r": 0.746, "overall_f1": 0.753}, "metrics_before": {"ADDRESS_f1": 0.646, "ADDRESS_r": 0.604, "BANK_ACCOUNT_f1": 0.701, "BANK_ACCOUNT_r": 0.598, "DATE_OF_BIRTH_f1": 0.544, "DATE_OF_BIRTH_r": 0.447, "ORGANIZATION_f1": 0.567, "ORGANIZATION_r": 0.458, "PERSON_f1": 0.736, "PERSON_r": 0.662, "overall_f1": 0.658}, "reason": "All entities improved. DATE_OF_BIRTH +27.2% (era abbreviation formats). ADDRESS +10.2%. Overall F1 65.8%→75.3%. No regressions.", "timestamp": "2026-04-02T21:00:00+09:00", "verdict": "KEEP"}, "metrics_after": {"ADDRESS_f1": 0.748, "ADDRESS_r": 0.733, "BANK_ACCOUNT_f1": 0.745, "BANK_ACCOUNT_r": 0.699, "DATE_OF_BIRTH_f1": 0.816, "DATE_OF_BIRTH_r": 0.739, "ORGANIZATION_f1": 0.621, "ORGANIZATION_r": 0.547, "PERSON_f1": 0.794, "PERSON_r": 0.746, "overall_f1": 0.753}, "metrics_before": {"ADDRESS_f1": 0.646, "ADDRESS_r": 0.604, "BANK_ACCOUNT_f1": 0.701, "BANK_ACCOUNT_r": 0.598, "DATE_OF_BIRTH_f1": 0.544, "DATE_OF_BIRTH_r": 0.447, "ORGANIZATION_f1": 0.567, "ORGANIZATION_r": 0.458, "PERSON_f1": 0.736, "PERSON_r": 0.662, "overall_f1": 0.658}, "reason": "All entities improved. DATE_OF_BIRTH +27.2% (era abbreviation formats). ADDRESS +10.2%. Overall F1 65.8%→75.3%. No regressions.", "timestamp": "2026-04-02T21:00:00+09:00", "verdict": "KEEP"}
{"baseline": "ja_benchmark_v0.4.0_to_v0.5.0", "data_hash": "unknown", "hypothesis": "No v0.4.0 template was truly saturated (>85% F1). v0.5.0 replaces semantically diffuse failure buckets with explicit templates for placeholder false positives, fragment boundary collapse, schema bleed, orthographic shifts, and geo/org type collisions while carrying forward minimal_context, corrupted_structured, and semantic_trap.", "id": "benchmark_v050_20260402", "intervention_type": "benchmark_versioning", "language": "ja", "legacy": {"difficulty_delta": -0.2481935858608677, "from_version": "v0.4.0", "id": "benchmark_v050_20260402", "language": "ja", "model_score_new_benchmark": 0.4098239869013508, "model_score_old_benchmark": 0.6580175727622185, "rationale": "No v0.4.0 template was truly saturated (>85% F1). v0.5.0 replaces semantically diffuse failure buckets with explicit templates for placeholder false positives, fragment boundary collapse, schema bleed, orthographic shifts, and geo/org type collisions while carrying forward minimal_context, corrupted_structured, and semantic_trap.", "templates_added": ["placeholder_mirage.j2", "fragment_chain.j2", "schema_bleed.j2", "orthography_shift.j2", "geo_org_switchback.j2"], "templates_carried": ["minimal_context.j2", "corrupted_structured.j2", "semantic_trap.j2"], "templates_dropped": ["adversarial_negative_v2.j2", "boundary_ambiguity.j2", "counter_context.j2", "dense_multi_entity.j2", "extreme_format.j2", "redacted_partial.j2", "type_confusion.j2"], "timestamp": "2026-04-02T13:20:02+09:00", "to_version": "v0.5.0", "type": "benchmark_evolution"}, "metrics_after": {"overall_f1": 0.4098239869013508}, "metrics_before": {"overall_f1": 0.6580175727622185}, "timestamp": "2026-04-02T13:20:02+09:00", "verdict": "NO_DECISION"}
{"baseline": "ja_benchmark_v0.5.0_to_v0.10.0", "data_hash": "unknown", "hypothesis": "v0.10.0 was rebuilt as a repo-fixed hand-authored DLP corpus rather than a synthetic generator. The final benchmark centers on realistic false-positive pressure from placeholders/spec docs plus OCR collapse, mixed-script aliasing, dense exports, and geo/org confusion. The same current model now drops from 41.0% on v0.5.0 to 9.97% on v0.10.0, meeting the quality gate without relying on OpenAI API generation.", "id": "benchmark_v100_20260402", "intervention_type": "benchmark_versioning", "language": "ja", "legacy": {"difficulty_delta": -0.3100864540929519, "from_version": "v0.5.0", "id": "benchmark_v100_20260402", "language": "ja", "model_score_new_benchmark": 0.09973753280839896, "model_score_old_benchmark": 0.4098239869013508, "rationale": "v0.10.0 was rebuilt as a repo-fixed hand-authored DLP corpus rather than a synthetic generator. The final benchmark centers on realistic false-positive pressure from placeholders/spec docs plus OCR collapse, mixed-script aliasing, dense exports, and geo/org confusion. The same current model now drops from 41.0% on v0.5.0 to 9.97% on v0.10.0, meeting the quality gate without relying on OpenAI API generation.", "templates_added": ["negative_placeholders.txt", "negative_specs.txt", "negative_placeholders_part2.txt", "negative_specs_part2.txt", "collapsed_boundaries_part2.txt", "orthography_aliases_part2.txt", "dense_exports_part2.txt", "geo_org_dense.txt", "geo_org_dense_part2.txt", "mixed_script_dense.txt", "mixed_script_dense_part2.txt"], "templates_carried": [], "templates_dropped": ["placeholder_mirage.j2", "fragment_chain.j2", "schema_bleed.j2", "minimal_context.j2", "orthography_shift.j2", "corrupted_structured.j2", "semantic_trap.j2", "geo_org_switchback.j2"], "timestamp": "2026-04-02T14:05:37+09:00", "to_version": "v0.10.0", "type": "benchmark_evolution"}, "metrics_after": {"overall_f1": 0.09973753280839896}, "metrics_before": {"overall_f1": 0.4098239869013508}, "timestamp": "2026-04-02T14:05:37+09:00", "verdict": "NO_DECISION"}
{"baseline": "ja_benchmark_v0.10.0_to_v0.11.0", "data_hash": "unknown", "hypothesis": "v0.10.0 remains the hard quality gate. v0.11.0 adds a broader hand-authored DLP benchmark with support, OCR, mail, HR, medical, legal, insurance, logistics, CRM, mixed dummy-real, and general-document negative slices. The benchmark intentionally includes many non-PII general documents to surface false positives, yielding a 33.3% clean-negative rate and 66 predicted entities across 60 negative documents.", "id": "benchmark_v110_20260402", "intervention_type": "benchmark_versioning", "language": "ja", "legacy": {"docs": 180, "from_version": "v0.10.0", "id": "benchmark_v110_20260402", "language": "ja", "model_score_benchmark_v011": 0.6572164948453608, "model_score_gate_v010": 0.09973753280839896, "negative_doc_clean_rate": 0.3333333333333333, "negative_docs": 60, "negative_fp_total": 66, "rationale": "v0.10.0 remains the hard quality gate. v0.11.0 adds a broader hand-authored DLP benchmark with support, OCR, mail, HR, medical, legal, insurance, logistics, CRM, mixed dummy-real, and general-document negative slices. The benchmark intentionally includes many non-PII general documents to surface false positives, yielding a 33.3% clean-negative rate and 66 predicted entities across 60 negative documents.", "suite_kind": "benchmark", "templates_added": ["support_tickets_a.txt", "support_tickets_b.txt", "ocr_forms_a.txt", "payment_exports_a.txt", "mail_threads_a.txt", "hr_records_a.txt", "medical_referrals_a.txt", "legal_notices_a.txt", "insurance_claims_a.txt", "logistics_labels_a.txt", "crm_notes_a.txt", "mixed_dummy_real_a.txt", "negative_operational_a.txt", "negative_operational_b.txt", "public_information_a.txt", "meeting_minutes_a.txt", "product_manuals_a.txt", "news_features_a.txt"], "timestamp": "2026-04-02T14:44:46+09:00", "to_version": "v0.11.0", "type": "benchmark_expansion"}, "metrics_after": {"overall_f1": 0.6572164948453608}, "metrics_before": {"overall_f1": 0.09973753280839896}, "timestamp": "2026-04-02T14:44:46+09:00", "verdict": "NO_DECISION"}
{"baseline": "ja_benchmark_v0.11.0_refine1", "data_hash": "unknown", "hypothesis": "v0.11.0 was too easy and too narrow. The refinement doubles down on general-document false-positive pressure and subtle leak slices: public bulletins, meeting minutes, manuals, news features, technical blogs, community notices, and partially leaked attachments/redacted public docs. This expands the suite to 360 docs, 160 negatives, and materially increases false-positive exposure while preserving broad DLP domain coverage.", "id": "benchmark_v110_refine_20260402", "intervention_type": "benchmark_versioning", "language": "ja", "legacy": {"docs_after": 360, "docs_before": 180, "from_version": "v0.11.0", "id": "benchmark_v110_refine_20260402", "language": "ja", "model_score_after": 0.631083202511774, "model_score_before": 0.6572164948453608, "negative_doc_clean_rate_after": 0.3375, "negative_doc_clean_rate_before": 0.3333333333333333, "negative_docs_after": 160, "negative_docs_before": 60, "negative_fp_total_after": 186, "negative_fp_total_before": 66, "rationale": "v0.11.0 was too easy and too narrow. The refinement doubles down on general-document false-positive pressure and subtle leak slices: public bulletins, meeting minutes, manuals, news features, technical blogs, community notices, and partially leaked attachments/redacted public docs. This expands the suite to 360 docs, 160 negatives, and materially increases false-positive exposure while preserving broad DLP domain coverage.", "suite_kind": "benchmark", "templates_added": ["negative_operational_c.txt", "negative_operational_d.txt", "public_information_b.txt", "meeting_minutes_b.txt", "product_manuals_b.txt", "news_features_b.txt", "community_bulletins_a.txt", "academic_articles_a.txt", "travel_guides_a.txt", "technical_blogs_a.txt", "subtle_mentions_a.txt", "subtle_mentions_b.txt", "subtle_mentions_c.txt", "subtle_mentions_d.txt", "mixed_context_reports_a.txt", "mixed_context_reports_b.txt", "leaked_attachments_a.txt", "partially_redacted_public_a.txt"], "timestamp": "2026-04-02T16:13:11+09:00", "to_version": "v0.11.0", "type": "benchmark_refinement"}, "metrics_after": {"overall_f1": 0.631083202511774}, "metrics_before": {"overall_f1": 0.6572164948453608}, "timestamp": "2026-04-02T16:13:11+09:00", "verdict": "NO_DECISION"}
{"baseline": "ja_frozen_benchmark_v0.4.0", "data_hash": "unknown", "duration_minutes": 35, "hypothesis": "Add v0.5.0 weakness-targeted templates: orthography_shift (romaji/hiragana/wide-space names, English org names), fragment_chain (weak-delimiter entity chains), geo_org_switchback (geo-named ORGs vs real ADDRESSes), placeholder_mirage negatives. Cloud: RunPod CPU5 4vCPU/8GB $0.14/hr.", "id": "20260402_iter05_v05_orthography_fragment_geo", "intervention_type": "data_augmentation", "language": "ja", "legacy": {"changes": ["packages/training/src/pleno_ner_training/augment_ja_data.py"], "delta": {"ADDRESS_f1_v04": "-0.040", "BANK_ACCOUNT_f1_v04": "-0.032", "ORGANIZATION_f1_v05": "+0.073", "overall_f1_v04": "-0.010", "overall_f1_v05": "+0.049"}, "duration_minutes": 35, "hypothesis": "Add v0.5.0 weakness-targeted templates: orthography_shift (romaji/hiragana/wide-space names, English org names), fragment_chain (weak-delimiter entity chains), geo_org_switchback (geo-named ORGs vs real ADDRESSes), placeholder_mirage negatives. Cloud: RunPod CPU5 4vCPU/8GB $0.14/hr.", "id": "20260402_iter05_v05_orthography_fragment_geo", "intervention_type": "data_augmentation", "language": "ja", "metrics_after": {"overall_f1_v04": 0.743, "overall_f1_v05": 0.71}, "metrics_before": {"overall_f1_v04": 0.753, "overall_f1_v05": 0.661}, "reason": "v0.4.0 ADDRESS -4.0% and BANK_ACCOUNT -3.2% regressions exceed 2% threshold. v0.5.0 improved +4.9% but cannot accept v0.4.0 regressions. Reverted to iter1 model.", "timestamp": "2026-04-02T23:00:00+09:00", "verdict": "DISCARD"}, "metrics_after": {"overall_f1": 0.743, "overall_f1_v04": 0.743, "overall_f1_v05": 0.71}, "metrics_before": {"overall_f1": 0.753, "overall_f1_v04": 0.753, "overall_f1_v05": 0.661}, "reason": "v0.4.0 ADDRESS -4.0% and BANK_ACCOUNT -3.2% regressions exceed 2% threshold. v0.5.0 improved +4.9% but cannot accept v0.4.0 regressions. Reverted to iter1 model.", "timestamp": "2026-04-02T23:00:00+09:00", "verdict": "DISCARD"}
{"baseline": "ja_benchmark_v0.11.0_refine2", "data_hash": "unknown", "hypothesis": "The first v0.11.0 expansion still retained too many explicit, structured positives that the current model handles well. This refinement replaces them with subtler free-text support/HR/medical/legal/insurance/logistics/CRM slices and adds more general operational negatives, reducing overall F1 from 63.1% to 56.1% while increasing negative pressure.", "id": "benchmark_v110_refine2_20260402", "intervention_type": "benchmark_versioning", "language": "ja", "legacy": {"docs_after": 330, "docs_before": 360, "from_version": "v0.11.0", "id": "benchmark_v110_refine2_20260402", "language": "ja", "model_score_after": 0.561122244488978, "model_score_before": 0.631083202511774, "negative_doc_clean_rate_after": 0.35, "negative_doc_clean_rate_before": 0.3375, "negative_docs_after": 180, "negative_docs_before": 160, "negative_fp_total_after": 208, "negative_fp_total_before": 186, "rationale": "The first v0.11.0 expansion still retained too many explicit, structured positives that the current model handles well. This refinement replaces them with subtler free-text support/HR/medical/legal/insurance/logistics/CRM slices and adds more general operational negatives, reducing overall F1 from 63.1% to 56.1% while increasing negative pressure.", "suite_kind": "benchmark", "templates_added": ["support_tickets_c.txt", "hr_records_b.txt", "medical_referrals_b.txt", "legal_notices_b.txt", "insurance_claims_b.txt", "logistics_labels_b.txt", "crm_notes_b.txt", "general_operations_a.txt", "general_operations_b.txt"], "templates_dropped": ["support_tickets_a.txt", "support_tickets_b.txt", "mail_threads_a.txt", "hr_records_a.txt", "medical_referrals_a.txt", "legal_notices_a.txt", "insurance_claims_a.txt", "logistics_labels_a.txt", "crm_notes_a.txt", "subtle_mentions_a.txt", "subtle_mentions_b.txt", "mixed_context_reports_b.txt"], "timestamp": "2026-04-02T16:24:37+09:00", "to_version": "v0.11.0", "type": "benchmark_refinement"}, "metrics_after": {"overall_f1": 0.561122244488978}, "metrics_before": {"overall_f1": 0.631083202511774}, "timestamp": "2026-04-02T16:24:37+09:00", "verdict": "NO_DECISION"}
