{"baseline": "ja_benchmark_v0.11.0_refine3", "data_hash": "unknown", "hypothesis": "Even after the second refinement, v0.11.0 still contained too many positive slices that behaved like lightly disguised extraction tasks. The final refinement narrows the benchmark to the broad-but-hard subset: OCR residue, exported records, leaked attachments, partially redacted public docs, mixed dummy-real cases, and a large general-document negative envelope. This lowers overall F1 from 56.1% to 38.6% while preserving 240 docs and 180 negative docs.", "id": "benchmark_v110_refine3_20260402", "intervention_type": "benchmark_versioning", "language": "ja", "legacy": {"docs_after": 240, "docs_before": 330, "from_version": "v0.11.0", "id": "benchmark_v110_refine3_20260402", "language": "ja", "model_score_after": 0.38615664845173037, "model_score_before": 0.561122244488978, "negative_doc_clean_rate_after": 0.35, "negative_doc_clean_rate_before": 0.35, "negative_docs_after": 180, "negative_docs_before": 180, "negative_fp_total_after": 208, "negative_fp_total_before": 208, "rationale": "Even after the second refinement, v0.11.0 still contained too many positive slices that behaved like lightly disguised extraction tasks. The final refinement narrows the benchmark to the broad-but-hard subset: OCR residue, exported records, leaked attachments, partially redacted public docs, mixed dummy-real cases, and a large general-document negative envelope. This lowers overall F1 from 56.1% to 38.6% while preserving 240 docs and 180 negative docs.", "suite_kind": "benchmark", "templates_added": ["general_operations_a.txt", "general_operations_b.txt"], "templates_dropped": ["support_tickets_c.txt", "hr_records_b.txt", "medical_referrals_b.txt", "legal_notices_b.txt", "insurance_claims_b.txt", "crm_notes_b.txt", "subtle_mentions_c.txt", "subtle_mentions_d.txt", "mixed_context_reports_a.txt"], "timestamp": "2026-04-02T16:39:13+09:00", "to_version": "v0.11.0", "type": "benchmark_refinement"}, "metrics_after": {"overall_f1": 0.38615664845173037}, "metrics_before": {"overall_f1": 0.561122244488978}, "timestamp": "2026-04-02T16:39:13+09:00", "verdict": "NO_DECISION"}
{"baseline": "ja_benchmark_v0.11.0_refine4", "data_hash": "unknown", "hypothesis": "v0.11.0 was still too extractive. This refinement adds more general operational negatives such as release notes, product pages, user forums, municipal guides, academic notices, travel blogs, press releases, and onboarding docs. The benchmark now reaches 320 docs with 260 negatives, pushes clean-negative rate up to 35.8%, and lowers overall F1 from 38.6% to 33.4%.", "id": "benchmark_v110_refine4_20260402", "intervention_type": "benchmark_versioning", "language": "ja", "legacy": {"docs_after": 320, "docs_before": 240, "from_version": "v0.11.0", "id": "benchmark_v110_refine4_20260402", "language": "ja", "model_score_after": 0.334384858044164, "model_score_before": 0.38615664845173037, "negative_doc_clean_rate_after": 0.3576923076923077, "negative_doc_clean_rate_before": 0.35, "negative_docs_after": 260, "negative_docs_before": 180, "negative_fp_total_after": 293, "negative_fp_total_before": 208, "rationale": "v0.11.0 was still too extractive. This refinement adds more general operational negatives such as release notes, product pages, user forums, municipal guides, academic notices, travel blogs, press releases, and onboarding docs. The benchmark now reaches 320 docs with 260 negatives, pushes clean-negative rate up to 35.8%, and lowers overall F1 from 38.6% to 33.4%.", "suite_kind": "benchmark", "templates_added": ["release_notes_a.txt", "product_pages_a.txt", "forum_threads_a.txt", "municipal_guides_a.txt", "academic_notices_b.txt", "travel_blogs_b.txt", "press_releases_a.txt", "onboarding_docs_a.txt"], "timestamp": "2026-04-02T16:52:28+09:00", "to_version": "v0.11.0", "type": "benchmark_refinement"}, "metrics_after": {"overall_f1": 0.334384858044164}, "metrics_before": {"overall_f1": 0.38615664845173037}, "timestamp": "2026-04-02T16:52:28+09:00", "verdict": "NO_DECISION"}
{"baseline": "ja_benchmark_v0.11.0_to_v0.12.0", "data_hash": "unknown", "hypothesis": "v0.11.0 still left too much room for the model on broad benchmark slices. v0.12.0 keeps the broad hard subset from v0.11.0 and adds nine new negative-heavy corpus packs focused on facility/organization false positives, bank-like codes, placeholders, policy pages, FAQ/general guides, route labels, UI mocks, and glossary pages. This pushes the benchmark to 500 docs, 320 negatives, and lowers the same model from 33.4% to 26.3% F1.", "id": "benchmark_v120_20260402", "intervention_type": "benchmark_versioning", "language": "ja", "legacy": {"difficulty_delta": -0.0710308207770832, "docs": 500, "from_version": "v0.11.0", "id": "benchmark_v120_20260402", "language": "ja", "model_score_new_benchmark": 0.2633540372670808, "model_score_old_benchmark": 0.334384858044164, "negative_doc_clean_rate": 0.3522727272727273, "negative_docs": 320, "negative_fp_total": 464, "rationale": "v0.11.0 still left too much room for the model on broad benchmark slices. v0.12.0 keeps the broad hard subset from v0.11.0 and adds nine new negative-heavy corpus packs focused on facility/organization false positives, bank-like codes, placeholders, policy pages, FAQ/general guides, route labels, UI mocks, and glossary pages. This pushes the benchmark to 500 docs, 320 negatives, and lowers the same model from 33.4% to 26.3% F1.", "suite_kind": "benchmark", "templates_added": ["facility_org_false_positive_a.txt", "bankish_code_negative_a.txt", "catalog_placeholder_negative_a.txt", "policy_pages_negative_a.txt", "faq_negative_b.txt", "event_brochures_negative_a.txt", "route_guides_negative_a.txt", "ui_mock_negative_a.txt", "docs_glossary_negative_a.txt"], "templates_carried": ["ocr_forms_a.txt", "payment_exports_a.txt", "logistics_labels_b.txt", "mixed_dummy_real_a.txt", "negative_operational_a.txt", "negative_operational_b.txt", "negative_operational_c.txt", "negative_operational_d.txt", "public_information_a.txt", "public_information_b.txt", "meeting_minutes_a.txt", "meeting_minutes_b.txt", "product_manuals_a.txt", "product_manuals_b.txt", "news_features_a.txt", "news_features_b.txt", "community_bulletins_a.txt", "academic_articles_a.txt", "travel_guides_a.txt", "technical_blogs_a.txt", "leaked_attachments_a.txt", "partially_redacted_public_a.txt", "general_operations_a.txt", "general_operations_b.txt", "release_notes_a.txt", "product_pages_a.txt", "forum_threads_a.txt", "municipal_guides_a.txt", "academic_notices_b.txt", "travel_blogs_b.txt", "press_releases_a.txt", "onboarding_docs_a.txt"], "templates_dropped": [], "timestamp": "2026-04-02T17:14:55+09:00", "to_version": "v0.12.0", "type": "benchmark_evolution"}, "metrics_after": {"overall_f1": 0.2633540372670808}, "metrics_before": {"overall_f1": 0.334384858044164}, "timestamp": "2026-04-02T17:14:55+09:00", "verdict": "NO_DECISION"}
{"baseline": "ja_frozen_benchmark_v0.4.0", "data_hash": "unknown", "duration_minutes": 45, "hypothesis": "Generate high-quality LLM training data with 4 new prompt templates targeting v0.4.0/v0.5.0 weaknesses: structured_data.j2, orthography_mixed.j2, geo_org_context.j2, fragment_memo.j2. Merge ja-v02 + ja-v02-extra = 23516 docs.", "id": "20260402_iter06_llm_quality_data", "intervention_type": "data_generation", "language": "ja", "legacy": {"changes": ["prompts/ja/structured_data.j2", "prompts/ja/orthography_mixed.j2", "prompts/ja/geo_org_context.j2", "prompts/ja/fragment_memo.j2"], "delta": {"ORGANIZATION_f1_v04": "+0.129", "overall_f1_v04": "+0.076", "overall_f1_v05": "+0.145"}, "duration_minutes": 45, "hypothesis": "Generate high-quality LLM training data with 4 new prompt templates targeting v0.4.0/v0.5.0 weaknesses: structured_data.j2, orthography_mixed.j2, geo_org_context.j2, fragment_memo.j2. Merge ja-v02 + ja-v02-extra = 23516 docs.", "id": "20260402_iter06_llm_quality_data", "intervention_type": "data_generation", "language": "ja", "metrics_after": {"overall_f1_v04": 0.829, "overall_f1_v05": 0.806}, "metrics_before": {"overall_f1_v04": 0.753, "overall_f1_v05": 0.661}, "reason": "All entities improved. ORG +12.9%, ADDRESS +8.8% on v0.4.0. v0.5.0 +14.5%. LLM data quality was the key breakthrough.", "timestamp": "2026-04-02T17:00:00+09:00", "verdict": "KEEP"}, "metrics_after": {"overall_f1": 0.829, "overall_f1_v04": 0.829, "overall_f1_v05": 0.806}, "metrics_before": {"overall_f1": 0.753, "overall_f1_v04": 0.753, "overall_f1_v05": 0.661}, "reason": "All entities improved. ORG +12.9%, ADDRESS +8.8% on v0.4.0. v0.5.0 +14.5%. LLM data quality was the key breakthrough.", "timestamp": "2026-04-02T17:00:00+09:00", "verdict": "KEEP"}
{"baseline": "ja_frozen_benchmark_v0.4.0", "data_hash": "unknown", "duration_minutes": 60, "hypothesis": "Add 2 ORG-focused LLM prompts (org_dense.j2 for 3-5 ORGs/doc, org_variety.j2 for non-corporate ORGs). ja-v02-extra grew 7551→12202 docs. Merged total 28167 docs. Trained locally on M3 Mac.", "id": "20260402_iter07_org_focused_data", "intervention_type": "data_generation", "language": "ja", "legacy": {"changes": ["prompts/ja/org_dense.j2", "prompts/ja/org_variety.j2"], "delta": {"ORGANIZATION_f1_v04": "+0.035", "PERSON_f1_v04": "+0.052", "overall_f1_v04": "+0.028", "overall_f1_v05": "+0.028"}, "duration_minutes": 60, "hypothesis": "Add 2 ORG-focused LLM prompts (org_dense.j2 for 3-5 ORGs/doc, org_variety.j2 for non-corporate ORGs). ja-v02-extra grew 7551→12202 docs. Merged total 28167 docs. Trained locally on M3 Mac.", "id": "20260402_iter07_org_focused_data", "intervention_type": "data_generation", "language": "ja", "metrics_after": {"ADDRESS_f1_v04": 0.836, "BANK_ACCOUNT_f1_v04": 0.828, "DATE_OF_BIRTH_f1_v04": 0.876, "ORGANIZATION_f1_v04": 0.785, "PERSON_f1_v04": 0.907, "overall_f1_v04": 0.857, "overall_f1_v05": 0.834}, "metrics_before": {"ORGANIZATION_f1_v04": 0.75, "PERSON_f1_v04": 0.855, "overall_f1_v04": 0.829, "overall_f1_v05": 0.806}, "reason": "PERSON 90.7% passed threshold. ORG +3.5%. Overall 85.7%. No regressions.", "timestamp": "2026-04-02T18:30:00+09:00", "verdict": "KEEP"}, "metrics_after": {"ADDRESS_f1_v04": 0.836, "BANK_ACCOUNT_f1_v04": 0.828, "DATE_OF_BIRTH_f1_v04": 0.876, "ORGANIZATION_f1_v04": 0.785, "PERSON_f1_v04": 0.907, "overall_f1": 0.857, "overall_f1_v04": 0.857, "overall_f1_v05": 0.834}, "metrics_before": {"ORGANIZATION_f1_v04": 0.75, "PERSON_f1_v04": 0.855, "overall_f1": 0.829, "overall_f1_v04": 0.829, "overall_f1_v05": 0.806}, "reason": "PERSON 90.7% passed threshold. ORG +3.5%. Overall 85.7%. No regressions.", "timestamp": "2026-04-02T18:30:00+09:00", "verdict": "KEEP"}
{"baseline": "ja_frozen_benchmark_v0.4.0", "data_hash": "unknown", "duration_minutes": 90, "hypothesis": "Increase data volume: ja-v02-extra batches 20→40, total 38189 docs (+36%). ORG 28092 instances (+54%).", "id": "20260402_iter08_data_volume_increase", "intervention_type": "data_generation", "language": "ja", "legacy": {"changes": [], "delta": {"DATE_OF_BIRTH_f1_v04": "-0.064", "PERSON_f1_v04": "-0.021", "overall_f1_v04": "-0.018"}, "duration_minutes": 90, "hypothesis": "Increase data volume: ja-v02-extra batches 20→40, total 38189 docs (+36%). ORG 28092 instances (+54%).", "id": "20260402_iter08_data_volume_increase", "intervention_type": "data_generation", "language": "ja", "metrics_after": {"overall_f1_v04": 0.839, "overall_f1_v05": 0.853}, "metrics_before": {"overall_f1_v04": 0.857, "overall_f1_v05": 0.834}, "reason": "DOB -6.4%, PERSON -2.1% on v0.4.0. Data volume increase diluted existing pattern learning. Reverted to iter4 model (v0.4.0 F1=85.7%).", "timestamp": "2026-04-03T02:00:00+09:00", "verdict": "DISCARD"}, "metrics_after": {"overall_f1": 0.839, "overall_f1_v04": 0.839, "overall_f1_v05": 0.853}, "metrics_before": {"overall_f1": 0.857, "overall_f1_v04": 0.857, "overall_f1_v05": 0.834}, "reason": "DOB -6.4%, PERSON -2.1% on v0.4.0. Data volume increase diluted existing pattern learning. Reverted to iter4 model (v0.4.0 F1=85.7%).", "timestamp": "2026-04-03T02:00:00+09:00", "verdict": "DISCARD"}
{"baseline": "ja_frozen_benchmark_v0.4.0", "data_hash": "unknown", "duration_minutes": 55, "hypothesis": "Add org_hard_negative.j2 LLM prompt + ORG hard negative distractors in augmentation. Generated 2540 new LLM docs from ALL templates, merged total 35729→40979 augmented docs.", "id": "20260402_iter08a_org_hard_neg_llm_data", "intervention_type": "data_generation", "language": "ja", "legacy": {"changes": ["prompts/ja/org_hard_negative.j2", "augment_ja_data.py"], "delta": {"ORGANIZATION_f1_v04": "-0.372", "neg_clean_v12": "+0.175", "overall_f1_v04": "-0.262", "overall_f1_v12": "+0.047"}, "duration_minutes": 55, "hypothesis": "Add org_hard_negative.j2 LLM prompt + ORG hard negative distractors in augmentation. Generated 2540 new LLM docs from ALL templates, merged total 35729→40979 augmented docs.", "id": "20260402_iter08a_org_hard_neg_llm_data", "intervention_type": "data_generation", "language": "ja", "metrics_after": {"ORGANIZATION_f1_v04": 0.413, "neg_clean_v12": 0.527, "overall_f1_v04": 0.595, "overall_f1_v12": 0.31}, "metrics_before": {"ORGANIZATION_f1_v04": 0.785, "neg_clean_v12": 0.352, "overall_f1_v04": 0.857, "overall_f1_v12": 0.263}, "reason": "v0.4.0 catastrophic regression -26.2%. New LLM data from all templates polluted training. v0.12.0 FP reduction worked (+17.5% neg clean rate) but overall model collapsed. Root cause: bulk LLM generation across all templates introduced annotation errors.", "timestamp": "2026-04-02T10:17:00+09:00", "verdict": "DISCARD"}, "metrics_after": {"ORGANIZATION_f1_v04": 0.413, "neg_clean_v12": 0.527, "overall_f1": 0.595, "overall_f1_v04": 0.595, "overall_f1_v12": 0.31}, "metrics_before": {"ORGANIZATION_f1_v04": 0.785, "neg_clean_v12": 0.352, "overall_f1": 0.857, "overall_f1_v04": 0.857, "overall_f1_v12": 0.263}, "reason": "v0.4.0 catastrophic regression -26.2%. New LLM data from all templates polluted training. v0.12.0 FP reduction worked (+17.5% neg clean rate) but overall model collapsed. Root cause: bulk LLM generation across all templates introduced annotation errors.", "timestamp": "2026-04-02T10:17:00+09:00", "verdict": "DISCARD"}
{"baseline": "ja_frozen_benchmark_v0.4.0", "data_hash": "unknown", "duration_minutes": 30, "hypothesis": "Augmentation-only: add 20 ORG hard negative distractor texts (facility/event/product/law names) to augment_ja_data.py, reduce distractor ratio 10%→7%, add org_hard_neg 8%. NO new LLM data. Trained on 28417 docs (reduced from iter07's ~33K due to accidental git revert of unstaged extra data).", "id": "20260402_iter08b_aug_only_no_new_llm", "intervention_type": "data_augmentation", "language": "ja", "legacy": {"changes": ["augment_ja_data.py"], "delta": {"ADDRESS_f1_v04": "+0.035", "ORGANIZATION_f1_v04": "-0.085", "neg_clean_v12": "+0.223", "overall_f1_v04": "-0.025", "overall_f1_v12": "+0.221"}, "duration_minutes": 30, "hypothesis": "Augmentation-only: add 20 ORG hard negative distractor texts (facility/event/product/law names) to augment_ja_data.py, reduce distractor ratio 10%→7%, add org_hard_neg 8%. NO new LLM data. Trained on 28417 docs (reduced from iter07's ~33K due to accidental git revert of unstaged extra data).", "id": "20260402_iter08b_aug_only_no_new_llm", "intervention_type": "data_augmentation", "language": "ja", "metrics_after": {"ADDRESS_f1_v04": 0.871, "BANK_ACCOUNT_f1_v04": 0.793, "DATE_OF_BIRTH_f1_v04": 0.878, "ORGANIZATION_f1_v04": 0.7, "PERSON_f1_v04": 0.869, "neg_clean_v12": 0.575, "overall_f1_v04": 0.832, "overall_f1_v12": 0.484}, "metrics_before": {"ADDRESS_f1_v04": 0.836, "BANK_ACCOUNT_f1_v04": 0.828, "DATE_OF_BIRTH_f1_v04": 0.876, "ORGANIZATION_f1_v04": 0.785, "PERSON_f1_v04": 0.907, "neg_clean_v12": 0.352, "overall_f1_v04": 0.857, "overall_f1_v12": 0.263}, "reason": "v0.4.0 overall -2.5%, ORG -8.5%, PERSON -3.8%. BUT v0.12.0 improved massively (+22.1% F1, +22.3% neg clean). Comparison unfair: training data volume reduced ~33K→28K due to accidental loss of unstaged extra data. ORG hard neg augmentation shows promise for FP reduction but needs full dataset to avoid regressions.", "timestamp": "2026-04-02T12:00:00+09:00", "verdict": "DISCARD"}, "metrics_after": {"ADDRESS_f1_v04": 0.871, "BANK_ACCOUNT_f1_v04": 0.793, "DATE_OF_BIRTH_f1_v04": 0.878, "ORGANIZATION_f1_v04": 0.7, "PERSON_f1_v04": 0.869, "neg_clean_v12": 0.575, "overall_f1": 0.832, "overall_f1_v04": 0.832, "overall_f1_v12": 0.484}, "metrics_before": {"ADDRESS_f1_v04": 0.836, "BANK_ACCOUNT_f1_v04": 0.828, "DATE_OF_BIRTH_f1_v04": 0.876, "ORGANIZATION_f1_v04": 0.785, "PERSON_f1_v04": 0.907, "neg_clean_v12": 0.352, "overall_f1": 0.857, "overall_f1_v04": 0.857, "overall_f1_v12": 0.263}, "reason": "v0.4.0 overall -2.5%, ORG -8.5%, PERSON -3.8%. BUT v0.12.0 improved massively (+22.1% F1, +22.3% neg clean). Comparison unfair: training data volume reduced ~33K→28K due to accidental loss of unstaged extra data. ORG hard neg augmentation shows promise for FP reduction but needs full dataset to avoid regressions.", "timestamp": "2026-04-02T12:00:00+09:00", "verdict": "DISCARD"}
{"baseline": "ja_frozen_benchmark_v0.4.0", "data_hash": "unknown", "duration_minutes": 50, "hypothesis": "score_weights ents_f=0.7, ents_r=0.3 to boost ORG recall. iter4 data (28167 docs).", "id": "20260403_iter09_recall_weight", "intervention_type": "training_config", "language": "ja", "legacy": {"changes": ["configs/train_cnn_recall.cfg"], "delta": {"ORGANIZATION_f1_v04": "-0.085", "overall_f1_v04": "-0.025"}, "duration_minutes": 50, "hypothesis": "score_weights ents_f=0.7, ents_r=0.3 to boost ORG recall. iter4 data (28167 docs).", "id": "20260403_iter09_recall_weight", "intervention_type": "training_config", "language": "ja", "metrics_after": {"ORGANIZATION_f1_v04": 0.7, "overall_f1_v04": 0.832}, "metrics_before": {"overall_f1_v04": 0.857}, "reason": "Overall -2.5%, ORG -8.5%. Recall weighting degraded precision without improving ORG recall.", "timestamp": "2026-04-03T04:00:00+09:00", "verdict": "DISCARD"}, "metrics_after": {"ORGANIZATION_f1_v04": 0.7, "overall_f1": 0.832, "overall_f1_v04": 0.832}, "metrics_before": {"overall_f1": 0.857, "overall_f1_v04": 0.857}, "reason": "Overall -2.5%, ORG -8.5%. Recall weighting degraded precision without improving ORG recall.", "timestamp": "2026-04-03T04:00:00+09:00", "verdict": "DISCARD"}
{"baseline": "ja_frozen_benchmark_v0.4.0", "data_hash": "unknown", "duration_minutes": 70, "hypothesis": "Error analysis driven: org_boundary.j2 targeting address-adjacent ORGs + short org names + bracket rules. Combined with team2's org_hard_negative.j2. Total 33891 docs.", "id": "20260403_iter10_error_analysis_org_boundary", "intervention_type": "data_generation", "language": "ja", "legacy": {"changes": ["prompts/ja/org_boundary.j2", "prompts/ja/org_hard_negative.j2 (team2)"], "delta": {"ORGANIZATION_f1_v04": "+0.060", "PERSON_f1_v04": "-0.022", "overall_f1_v04": "+0.012"}, "duration_minutes": 70, "hypothesis": "Error analysis driven: org_boundary.j2 targeting address-adjacent ORGs + short org names + bracket rules. Combined with team2's org_hard_negative.j2. Total 33891 docs.", "id": "20260403_iter10_error_analysis_org_boundary", "intervention_type": "data_generation", "language": "ja", "metrics_after": {"ADDRESS_f1_v04": 0.84, "BANK_ACCOUNT_f1_v04": 0.869, "DATE_OF_BIRTH_f1_v04": 0.912, "ORGANIZATION_f1_v04": 0.845, "PERSON_f1_v04": 0.885, "overall_f1_v04": 0.869, "overall_f1_v05": 0.867}, "metrics_before": {"ORGANIZATION_f1_v04": 0.785, "overall_f1_v04": 0.857}, "reason": "ORG +6.0% (84.5%, 0.5% from threshold). Overall 86.9%. PERSON -2.2% but still above recall minimum. Error analysis was key breakthrough for ORG.", "timestamp": "2026-04-03T06:00:00+09:00", "verdict": "KEEP"}, "metrics_after": {"ADDRESS_f1_v04": 0.84, "BANK_ACCOUNT_f1_v04": 0.869, "DATE_OF_BIRTH_f1_v04": 0.912, "ORGANIZATION_f1_v04": 0.845, "PERSON_f1_v04": 0.885, "overall_f1": 0.869, "overall_f1_v04": 0.869, "overall_f1_v05": 0.867}, "metrics_before": {"ORGANIZATION_f1_v04": 0.785, "overall_f1": 0.857, "overall_f1_v04": 0.857}, "reason": "ORG +6.0% (84.5%, 0.5% from threshold). Overall 86.9%. PERSON -2.2% but still above recall minimum. Error analysis was key breakthrough for ORG.", "timestamp": "2026-04-03T06:00:00+09:00", "verdict": "KEEP"}
{"baseline": "ja_frozen_benchmark_v0.4.0", "data_hash": "unknown", "duration_minutes": 60, "hypothesis": "Add v0.12.0-targeted negative augmentation (20 OCR/placeholder/facility/education negative texts). Neg ratio 27%→34%. RunPod CPU5 8vCPU/16GB.", "id": "20260403_iter11_v12_negatives", "intervention_type": "data_augmentation", "language": "ja", "legacy": {"changes": ["augment_ja_data.py (v12_negatives)"], "delta": {"BANK_ACCOUNT_f1_v04": "-0.043", "DATE_OF_BIRTH_f1_v04": "-0.043", "overall_f1_v04": "-0.001", "overall_f1_v12": "+0.048"}, "duration_minutes": 60, "hypothesis": "Add v0.12.0-targeted negative augmentation (20 OCR/placeholder/facility/education negative texts). Neg ratio 27%→34%. RunPod CPU5 8vCPU/16GB.", "id": "20260403_iter11_v12_negatives", "intervention_type": "data_augmentation", "language": "ja", "metrics_after": {"neg_clean_rate_v12": 0.645, "overall_f1_v04": 0.868, "overall_f1_v12": 0.538}, "metrics_before": {"overall_f1_v04": 0.869, "overall_f1_v12": 0.49}, "reason": "v0.12.0 improved +4.8% but v0.4.0 DOB/BANK regressed -4.3% each. Neg augmentation diluted positive patterns.", "timestamp": "2026-04-03T08:00:00+09:00", "verdict": "DISCARD"}, "metrics_after": {"neg_clean_rate_v12": 0.645, "overall_f1": 0.868, "overall_f1_v04": 0.868, "overall_f1_v12": 0.538}, "metrics_before": {"overall_f1": 0.869, "overall_f1_v04": 0.869, "overall_f1_v12": 0.49}, "reason": "v0.12.0 improved +4.8% but v0.4.0 DOB/BANK regressed -4.3% each. Neg augmentation diluted positive patterns.", "timestamp": "2026-04-03T08:00:00+09:00", "verdict": "DISCARD"}
